EventId,Source,Type,Severity,TMC,Description,StartTime(UTC),EndTime(UTC),TimeZone,LocationLat,LocationLng,Distance(mi),AirportCode,Number,Street,Side,City,County,State,ZipCode
T-13251190,T,Accident,,201.0,Accident on Middle Fiskville Rd at Tirado St.,2018-07-11 16:30:52,2018-07-11 17:00:41,US/Central,30.323953999999997,-97.709877,0.0,KATT,801.0,Tirado St,R,Austin,Travis,TX,78752.0
T-13251193,T,Accident,,201.0,Accident on FM-1626 at Brodie Ln.,2018-07-11 16:40:27,2018-07-11 17:10:19,US/Central,30.141009999999998,-97.846649,0.0,KAUS,1924.0,W FM 1626,R,Austin,Travis,TX,78748.0
T-13251194,T,Accident,,201.0,Accident on Turk Ln at Cullen Ln.,2018-07-11 16:40:04,2018-07-11 17:09:50,US/Central,30.163421999999997,-97.79160300000001,0.0,KAUS,9598.0,Cullen Ln,R,Austin,Travis,TX,78748.0
T-13251202,T,Accident,,201.0,Accident on Harold Ct at US-183 Ed Bluestein Blvd.,2018-07-11 16:57:17,2018-07-11 17:27:06,US/Central,30.266626000000002,-97.670578,0.0,KAUS,3163.0,Ed Bluestein Blvd,L,Austin,Travis,TX,78725.0
T-13251210,T,Accident,,201.0,Accident on Convict Hill Rd at Beckett Rd.,2018-07-11 17:13:17,2018-07-11 17:43:04,US/Central,30.220476,-97.857826,0.0,KATT,7336.0,Beckett Rd,R,Austin,Travis,TX,78749.0
T-13251220,T,Accident,,201.0,Accident on FM-734 Parmer Ln at TX-275 Loop Lamar Blvd.,2018-07-11 17:22:46,2018-07-11 17:52:31,US/Central,30.407840999999998,-97.67821500000001,0.0,KATT,,W Parmer Ln,R,Austin,Travis,TX,78727.0
T-13251228,T,Accident,,201.0,Accident on Montopolis Dr at Stassney Ln.,2018-07-11 17:50:39,2018-07-11 18:20:17,US/Central,30.205528,-97.71656,0.0,KAUS,,E Stassney Ln,R,Austin,Travis,TX,78744.0
T-13251232,T,Accident,,201.0,Accident on Rundberg Ln at Northgate Blvd.,2018-07-11 17:58:08,2018-07-11 18:27:39,US/Central,30.371986,-97.715591,0.0,KATT,1910.0,W Rundberg Ln,R,Austin,Travis,TX,78758.0
T-13251262,T,Accident,,201.0,Accident on Riverside Dr at Pleasant Valley Rd.,2018-07-11 19:08:52,2018-07-11 19:38:37,US/Central,30.234284999999996,-97.723618,0.0,KAUS,2557.0,E Riverside Dr,R,Austin,Travis,TX,78741.0
T-13251263,T,Accident,,201.0,Accident on Breeze Ter Northbound from Manor Rd to 32nd St.,2018-07-11 19:09:29,2018-07-11 19:39:09,US/Central,30.287322999999997,-97.71803299999999,0.0,KATT,3200.0,Breeze Ter,L,Austin,Travis,TX,78722.0
T-13251274,T,Accident,,201.0,Accident on TX-343 Lamar Blvd at Goodrich Ave.,2018-07-11 19:49:00,2018-07-11 20:18:47,US/Central,30.247428999999997,-97.774147,0.0,KATT,2234.0,S Lamar Blvd,R,Austin,Travis,TX,78704.0
T-13251292,T,Accident,,201.0,Accident on Gregg Ln at Howard Ln.,2018-07-11 20:33:28,2018-07-11 21:03:16,US/Central,30.385111,-97.614479,0.0,KEDC,,Gregg Ln,R,Manor,Travis,TX,78653.0
T-13251298,T,Accident,,201.0,Accident on Convict Hill Rd Westbound from Woodcreek Rd to Crooked Oak Cv.,2018-07-11 20:40:16,2018-07-11 21:09:33,US/Central,30.219247999999997,-97.855278,0.10000000149,KATT,5201.0,Convict Hill Rd,L,Austin,Travis,TX,78749.0
T-13251311,T,Accident,,201.0,Accident on 38th St at Airport Blvd.,2018-07-11 20:58:43,2018-07-11 21:28:31,US/Central,30.287598,-97.706924,0.0,KATT,3801.0,Airport Blvd,R,Austin,Travis,TX,78722.0
T-13251312,T,Accident,,201.0,Accident on RM-1431 Whitestone Blvd at New Hope Dr.,2018-07-11 20:58:16,2018-07-11 21:28:02,US/Central,30.515705,-97.870148,0.0,KRYW,2801.0,W Whitestone Blvd,L,Cedar Park,Travis,TX,78613.0
T-13251333,T,Accident,,201.0,Accident on Pearce Ln at Ross Rd.,2018-07-11 21:18:47,2018-07-11 21:48:30,US/Central,30.172424,-97.62944,0.0,KAUS,12208.0,Pearce Ln,L,Del Valle,Travis,TX,78617.0
T-13251334,T,Accident,,201.0,Accident on 45th St at Duval St.,2018-07-11 21:19:15,2018-07-11 21:49:01,US/Central,30.306998999999998,-97.724625,0.0,KATT,4500.0,Duval St,L,Austin,Travis,TX,78751.0
T-13251465,T,Accident,,201.0,Accident on Arbor Ln at 1st St.,2018-07-11 22:23:39,2018-07-11 22:52:52,US/Central,30.210602,-97.779785,0.0,KATT,601.0,Arbor Cir,L,Austin,Travis,TX,78745.0
T-13251469,T,Accident,,201.0,Accident on US-183 Northbound at Research Blvd.,2018-07-11 22:25:18,2018-07-11 22:54:51,US/Central,30.393665000000002,-97.74633,0.0,KATT,,US-183 N,R,Austin,Travis,TX,78759.0
T-13251482,T,Accident,,201.0,Accident on Riverside Dr at Summit St.,2018-07-11 22:26:58,2018-07-11 22:56:41,US/Central,30.246346999999997,-97.732063,0.0,KAUS,1601.0,E Riverside Dr,R,Austin,Travis,TX,78741.0
T-13251483,T,Accident,,201.0,Accident on Triangle Ave at 45th St.,2018-07-11 22:27:33,2018-07-11 22:57:18,US/Central,30.313177000000003,-97.737053,0.0,KATT,915.0,W 45th St,L,Austin,Travis,TX,78751.0
T-13251505,T,Accident,,201.0,Accident on Martin Luther King Jr Blvd at Lamar Blvd.,2018-07-11 22:29:23,2018-07-11 22:58:38,US/Central,30.283621000000004,-97.751999,0.0,KATT,,W Martin Luther King Jr Blvd,R,Austin,Travis,TX,78705.0
T-13251526,T,Accident,,201.0,Accident on TX-275 Loop Lamar Blvd Southbound at Payton Gin Rd.,2018-07-11 22:37:19,2018-07-11 23:06:47,US/Central,30.357439000000003,-97.700272,0.0,KATT,8833.0,N Lamar Blvd,R,Austin,Travis,TX,78753.0
T-13251624,T,Accident,,201.0,Accident on Dessau Rd at Bradbury Ln.,2018-07-11 23:17:09,2018-07-11 23:46:46,US/Central,30.39473,-97.644272,0.0,KEDC,12699.0,Dessau Rd,R,Austin,Travis,TX,78754.0
T-13251672,T,Accident,,201.0,Accident on Thaxton Rd at Jean Lorraine St.,2018-07-11 23:55:53,2018-07-12 00:25:31,US/Central,30.118856,-97.744263,0.0,KAUS,,Jean Lorraine St,R,Austin,Travis,TX,78747.0
T-13251673,T,Accident,,201.0,Accident on 5th St at Pressler St.,2018-07-11 23:56:14,2018-07-12 00:26:04,US/Central,30.272713,-97.760841,0.0,KATT,451.0,Pressler St,R,Austin,Travis,TX,78703.0
T-13251675,T,Accident,,201.0,Accident on Bradbury Ln Northbound at Dessau Rd.,2018-07-11 23:55:19,2018-07-12 00:24:40,US/Central,30.396209999999996,-97.643204,0.0,KEDC,12787.0,Dessau Rd,R,Austin,Travis,TX,78754.0
T-13251683,T,Accident,,201.0,Accident on US-183 Ed Bluestein Blvd Southbound at FM-969 Martin Luther King Jr Blvd.,2018-07-11 23:56:56,2018-07-12 00:26:26,US/Central,30.285740000000004,-97.665482,0.0,KAUS,5872.0,E Martin Luther King Jr Blvd,R,Austin,Travis,TX,78721.0
T-13251685,T,Accident,,201.0,Accident on Martin Luther King Jr Blvd at Oldfort Hill Dr.,2018-07-11 23:59:05,2018-07-12 00:28:48,US/Central,30.2866,-97.675179,0.0,KAUS,5301.0,E Martin Luther King Jr Blvd,R,Austin,Travis,TX,78721.0
T-13251692,T,Accident,,201.0,Accident on I-35 Southbound at Exits 232B 233 233B-234A 234B Riverside Dr.,2018-07-12 00:30:33,2018-07-12 00:59:49,US/Central,30.255916999999997,-97.73703,0.0,KATT,,I-35 S,R,Austin,Travis,TX,78701.0
T-13251708,T,Accident,,201.0,Accident on I-35 Southbound at Exits 226 227 Slaughter Ln.,2018-07-12 01:52:50,2018-07-12 02:22:03,US/Central,30.173865999999997,-97.781754,0.0,KATT,8300.0,S Interstate 35,R,Austin,Travis,TX,78745.0
T-13251736,T,Accident,,201.0,Accident on FM-734 Parmer Ln at Riata Vista Cir.,2018-07-12 02:51:04,2018-07-12 03:20:34,US/Central,30.437315,-97.735962,0.0,KATT,13498.0,Legendary Dr,L,Austin,Travis,TX,78727.0
T-13251761,T,Accident,,201.0,Accident on TX-275 Loop Lamar Blvd Southbound at Powell Ln.,2018-07-12 03:59:20,2018-07-12 04:28:50,US/Central,30.350637,-97.709572,0.0,KATT,7984.0,N Lamar Blvd,R,Austin,Travis,TX,78758.0
T-13280587,T,Accident,,201.0,Accident on Channel Rd at Sandy Acre Ln.,2018-07-12 09:24:57,2018-07-12 09:54:41,US/Central,30.34153,-97.788948,0.0,KATT,4001.0,Sandy Acre Ln,R,Austin,Travis,TX,78746.0
T-13280589,T,Accident,,201.0,Accident on Rockcliff Rd at Sandy Acre Ln.,2018-07-12 09:30:03,2018-07-12 09:59:47,US/Central,30.340590999999996,-97.789742,0.0,KATT,1698.0,Rockcliff Rd,R,Austin,Travis,TX,78746.0
T-13280596,T,Accident,,201.0,Accident on FM-969 at Gilbert Rd.,2018-07-12 09:58:42,2018-07-12 10:28:23,US/Central,30.251435999999998,-97.595673,0.0,KAUS,13000.0,FM 969,L,Austin,Travis,TX,78724.0
T-13280618,T,Accident,,201.0,Accident on Dessau Rd at FM-734 Parmer Ln.,2018-07-12 11:36:00,2018-07-12 12:05:47,US/Central,30.387026000000002,-97.648537,0.0,KEDC,,Dessau Rd,R,Austin,Travis,TX,78754.0
T-13280676,T,Accident,,201.0,Accident on 15th St at I-35 Exits 234C.,2018-07-12 12:48:37,2018-07-12 13:18:03,US/Central,30.274652000000003,-97.730965,0.0,KATT,1459.0,N Interstate 35,R,Austin,Travis,TX,78702.0
T-13280698,T,Accident,,201.0,Accident on William Cannon Dr at Bluff Dr.,2018-07-12 13:03:02,2018-07-12 13:32:44,US/Central,30.190860999999998,-97.771622,0.0,KATT,823.0,E William Cannon Dr,L,Austin,Travis,TX,78745.0
T-13280703,T,Accident,,201.0,Accident on RM-620 at Quinlan Park Rd.,2018-07-12 13:05:32,2018-07-12 13:35:03,US/Central,30.389742,-97.88224,0.0,KATT,4998.0,N Quinlan Park Rd,L,Austin,Travis,TX,78732.0
T-13280718,T,Accident,,201.0,Accident on 7th St at Levander Loop.,2018-07-12 13:32:21,2018-07-12 14:17:02,US/Central,30.252360999999997,-97.69596899999999,0.0,KATT,,Levander Loop,R,Austin,Travis,TX,78702.0
T-13280723,T,Accident,,201.0,Accident on Research Blvd Southbound at Mopac Expy.,2018-07-12 13:38:50,2018-07-12 14:07:59,US/Central,30.385510999999997,-97.743515,0.0,KATT,9458.0,Research Blvd,R,Austin,Travis,TX,78759.0
T-13280731,T,Accident,,201.0,Accident on TX-45 Westbound at Pecan Park.,2018-07-12 13:47:53,2018-07-12 14:32:13,US/Central,30.470995000000002,-97.789467,0.0,KATT,,TX-45 W,R,Austin,Williamson,TX,78717.0
T-13280759,T,Accident,,201.0,Accident on Rollingwood Dr at Dellana Ln.,2018-07-12 14:49:45,2018-07-12 15:49:36,US/Central,30.269102,-97.778526,0.0,KATT,2302.0,Rollingwood Dr,L,Austin,Travis,TX,78746.0
T-13280764,T,Accident,,201.0,Accident on Wells Branch Pkwy at Summit Dr.,2018-07-12 15:01:33,2018-07-12 16:01:15,US/Central,30.441475,-97.69207,0.0,KEDC,,Summit Dr,R,Austin,Travis,TX,78728.0
T-13280767,T,Accident,,201.0,Accident on Slaughter Ln at Beckett Rd.,2018-07-12 15:04:10,2018-07-12 16:03:59,US/Central,30.200888,-97.87089499999999,0.0,KATT,5756.0,W Slaughter Ln,R,Austin,Travis,TX,78749.0
T-13280777,T,Accident,,201.0,Accident on Lamar Blvd at Airport Blvd.,2018-07-12 15:37:19,2018-07-12 16:37:05,US/Central,30.337790999999996,-97.718773,0.0,KATT,,Airport Blvd,R,Austin,Travis,TX,78752.0
T-13280788,T,Accident,,201.0,Accident on Congress Ave at Dunlap St.,2018-07-12 16:11:14,2018-07-12 16:56:00,US/Central,30.224287,-97.763123,0.0,KATT,3898.0,S Congress Ave,R,Austin,Travis,TX,78704.0
T-13280794,T,Accident,,201.0,Accident on I-35 Northbound near Grand Avenue Pkwy.,2018-07-12 16:18:50,2018-07-12 16:48:29,US/Central,30.456015,-97.666321,0.0,KEDC,,I-35 N,R,Pflugerville,Travis,TX,78660.0
T-13280800,T,Accident,,201.0,Accident on McKinney Falls Pkwy at Burleson Rd.,2018-07-12 16:35:31,2018-07-12 17:05:19,US/Central,30.192040999999996,-97.698418,0.0,KAUS,7601.0,Burleson Rd,R,Austin,Travis,TX,78744.0
T-13280801,T,Accident,,201.0,Accident on Dove Springs Dr at Wagon Crossing Path.,2018-07-12 16:35:48,2018-07-12 17:05:42,US/Central,30.189493,-97.755325,0.0,KAUS,2406.0,Dove Springs Dr,L,Austin,Travis,TX,78744.0
T-13280813,T,Accident,,201.0,Accident on Steiner Ranch Blvd Northbound from Vista Verde Dr to RM-620.,2018-07-12 17:12:41,2018-07-12 17:42:19,US/Central,30.394771999999996,-97.866867,0.0,KATT,,Ranch Road 620 N,R,Austin,Travis,TX,78732.0
T-13280817,T,Accident,,201.0,Accident on William Cannon Dr at Bluff Springs Rd.,2018-07-12 17:17:32,2018-07-12 17:47:17,US/Central,30.189123,-97.767899,0.0,KAUS,1625.0,E William Cannon Dr,L,Austin,Travis,TX,78744.0
T-13280822,T,Accident,,201.0,Accident on RM-620 at Blue Ridge Dr.,2018-07-12 17:25:07,2018-07-12 17:54:54,US/Central,30.462792999999998,-97.814049,0.0,KATT,12299.0,Ranch Road 620 N,R,Austin,Travis,TX,78750.0
T-13280831,T,Accident,,201.0,Accident on Montopolis Dr at Oltorf.,2018-07-12 17:42:14,2018-07-12 18:12:00,US/Central,30.215040000000002,-97.710289,0.0,KAUS,,E Oltorf,R,Austin,Travis,TX,78741.0
T-13280850,T,Accident,,201.0,Accident on Howard Ln at McCallen Pass.,2018-07-12 18:30:07,2018-07-12 18:59:56,US/Central,30.419399,-97.66091899999999,0.0,KATT,,W Howard Ln,R,Austin,Travis,TX,78753.0
T-13280888,T,Accident,,201.0,Accident on Alice Mae Ln at Slaughter Ln.,2018-07-12 19:42:18,2018-07-12 20:12:03,US/Central,30.167562,-97.793053,0.0,KAUS,,Alice Mae Ln,R,Austin,Travis,TX,78748.0
T-13280889,T,Accident,,201.0,Accident on Saint Johns Ave at Lamar Blvd.,2018-07-12 19:42:36,2018-07-12 20:12:25,US/Central,30.339416999999997,-97.717857,0.0,KATT,772.0,W Saint Johns Ave,R,Austin,Travis,TX,78752.0
T-13280907,T,Accident,,201.0,Accident on Ponciana Dr at Conestoga Trl.,2018-07-12 20:08:25,2018-07-12 20:38:07,US/Central,30.195691999999998,-97.75737,0.0,KAUS,2006.0,Conestoga Trl,L,Austin,Travis,TX,78744.0
T-13280914,T,Accident,,201.0,Accident on The Lakes Blvd at Howard Ln.,2018-07-12 20:08:51,2018-07-12 20:38:36,US/Central,30.421684000000003,-97.665596,0.0,KEDC,906.0,W Howard Ln,R,Pflugerville,Travis,TX,78660.0
T-13280941,T,Accident,,201.0,Accident on Stassney Ln at Teri Rd.,2018-07-12 20:38:36,2018-07-12 21:08:00,US/Central,30.191277000000003,-97.73114,0.0,KAUS,5898.0,Teri Rd,L,Austin,Travis,TX,78744.0
T-13280942,T,Accident,,201.0,Accident on Braker Ln at Stonelake Blvd.,2018-07-12 20:37:47,2018-07-12 21:07:34,US/Central,30.398851,-97.73904399999999,0.0,KATT,,W Braker Ln,R,Austin,Travis,TX,78759.0
T-13280951,T,Accident,,201.0,Accident on Cesar Chavez St at Levander Loop.,2018-07-12 20:44:07,2018-07-12 21:13:46,US/Central,30.251064000000003,-97.69606800000001,0.0,KATT,,E Cesar Chavez St,R,Austin,Travis,TX,78702.0
T-13281006,T,Accident,,201.0,Accident on Gilbert Rd at FM-969.,2018-07-12 21:12:44,2018-07-12 21:42:20,US/Central,30.251435999999998,-97.595673,0.0,KAUS,13000.0,FM 969,L,Austin,Travis,TX,78724.0
T-13281023,T,Accident,,201.0,Accident on TX-343 Lamar Blvd at Mary St.,2018-07-12 21:23:48,2018-07-12 21:53:30,US/Central,30.249151,-97.767349,0.0,KATT,1330.0,W Mary St,L,Austin,Travis,TX,78704.0
T-13281074,T,Accident,,201.0,Accident on I-35 Northbound at Exits 228 228-229 William Cannon Dr.,2018-07-12 21:43:49,2018-07-12 22:13:21,US/Central,30.190359,-97.770462,0.0,KAUS,1601.0,E William Cannon Dr,L,Austin,Travis,TX,78744.0
T-13281115,T,Accident,,201.0,Accident on I-35 Northbound at Exits 228 228-229 William Cannon Dr.,2018-07-12 21:57:30,2018-07-12 22:27:10,US/Central,30.190540000000002,-97.769882,0.0,KAUS,6599.0,S Interstate 35,L,Austin,Travis,TX,78744.0
T-13281126,T,Accident,,201.0,Accident on I-35 Southbound at Exits 228 228-229 William Cannon Dr.,2018-07-12 21:59:19,2018-07-12 22:29:03,US/Central,30.190497999999998,-97.770554,0.0,KATT,899.0,E William Cannon Dr,L,Austin,Travis,TX,78745.0
T-13281127,T,Accident,,201.0,Accident on RM-620 at Four Points Dr.,2018-07-12 22:00:19,2018-07-12 22:29:38,US/Central,30.406678999999997,-97.852509,0.0,KRYW,,Four Points Dr,R,Austin,Travis,TX,78726.0
T-13281220,T,Accident,,201.0,Accident on FM-973 at Hogeye Rd.,2018-07-12 22:30:30,2018-07-12 23:00:17,US/Central,30.288578,-97.58354200000001,0.0,KAUS,7866.0,N FM 973,L,Austin,Travis,TX,78724.0
T-13281224,T,Accident,,201.0,Accident on Congress Ave at Dunlap St.,2018-07-12 22:34:29,2018-07-12 23:04:05,US/Central,30.224287,-97.763123,0.0,KATT,3898.0,S Congress Ave,R,Austin,Travis,TX,78704.0
T-13281316,T,Accident,,201.0,Accident on Thaxton Rd at Panadero Dr.,2018-07-12 22:58:59,2018-07-12 23:28:46,US/Central,30.157705,-97.74363699999999,0.0,KAUS,7962.0,Thaxton Rd,L,Austin,Travis,TX,78747.0
T-13281318,T,Accident,,201.0,Accident on I-35 Northbound at Exit 245 FM-734 Parmer Ln.,2018-07-12 22:59:23,2018-07-12 23:29:12,US/Central,30.403133,-97.674644,0.0,KATT,,N Interstate 35,R,Austin,Travis,TX,78753.0
T-13281319,T,Accident,,201.0,Accident on Four Iron Dr at Rustic Rock Dr.,2018-07-12 22:59:45,2018-07-12 23:29:35,US/Central,30.434442999999998,-97.77930500000001,0.0,KATT,11699.0,Four Iron Dr,R,Austin,Travis,TX,78750.0
T-13281404,T,Accident,,201.0,Accident on Old Koenig Ln at Lamar Blvd.,2018-07-13 00:11:21,2018-07-13 00:41:05,US/Central,30.327776,-97.72518199999999,0.0,KATT,5901.0,N Lamar Blvd,R,Austin,Travis,TX,78752.0
T-13281413,T,Accident,,201.0,Accident on US-290 at Gregg Manor Rd.,2018-07-13 00:26:15,2018-07-13 00:55:59,US/Central,30.348115999999997,-97.56235500000001,0.0,KEDC,,US Highway 290 E,R,Manor,Travis,TX,78653.0
T-13281449,T,Accident,,201.0,Accident on Springdale Rd at Mercer Dr.,2018-07-13 03:29:19,2018-07-13 03:59:02,US/Central,30.271310999999997,-97.691864,0.0,KAUS,1100.0,Mercer Dr,L,Austin,Travis,TX,78721.0
T-13281451,T,Accident,,201.0,Accident on Lamar Blvd at RM-2222 Koenig Ln.,2018-07-13 03:40:37,2018-07-13 04:10:17,US/Central,30.325706,-97.72618100000001,0.0,KATT,764.0,W Koenig Ln,R,Austin,Travis,TX,78752.0
T-13310418,T,Accident,,201.0,Accident on I-35 Svrd Southbound at Reinli St.,2018-07-13 09:11:09,2018-07-13 09:40:37,US/Central,30.318689000000003,-97.707695,0.0,KATT,5800.0,N Interstate 35,L,Austin,Travis,TX,78751.0
T-13310422,T,Accident,,201.0,Accident on I-35 Svrd Northbound at FM-1327.,2018-07-13 09:20:27,2018-07-13 09:49:48,US/Central,30.111284,-97.806725,0.0,KAUS,,S Interstate 35,R,Buda,Travis,TX,78610.0
T-13310431,T,Accident,,201.0,Accident on 12th St at Chicon St.,2018-07-13 09:30:41,2018-07-13 10:00:27,US/Central,30.273767,-97.719925,0.0,KATT,1899.0,E 12th St,R,Austin,Travis,TX,78702.0
T-13310434,T,Accident,,201.0,Accident on Thaxton Rd at Sassman Rd.,2018-07-13 09:36:28,2018-07-13 10:05:41,US/Central,30.142235,-97.729218,0.0,KAUS,8998.0,Thaxton Rd,L,Austin,Travis,TX,78747.0
T-13310459,T,Accident,,201.0,Accident on Lockwood Rd at Parsons Rd.,2018-07-13 11:41:18,2018-07-13 12:11:03,US/Central,30.308023,-97.515045,0.0,KEDC,11000.0,Parsons Rd,L,Manor,Travis,TX,78653.0
T-13310461,T,Accident,,201.0,Accident on 12th St at Chicon St.,2018-07-13 11:47:30,2018-07-13 12:17:12,US/Central,30.273767,-97.719925,0.0,KATT,1899.0,E 12th St,R,Austin,Travis,TX,78702.0
T-13310470,T,Accident,,201.0,Accident on Rundberg Ln at Cameron Rd .,2018-07-13 12:04:03,2018-07-13 12:33:37,US/Central,30.35078,-97.67600300000001,0.0,KATT,1499.0,E Rundberg Ln,R,Austin,Travis,TX,78753.0
T-13310475,T,Accident,,201.0,Accident on Cameron Rd at Coronado Hills Dr.,2018-07-13 12:14:46,2018-07-13 13:14:36,US/Central,30.329047999999997,-97.690399,0.0,KATT,7397.0,Cameron Rd,R,Austin,Travis,TX,78752.0
T-13310480,T,Accident,,201.0,Accident on Payload Pass Westbound at Ben White Blvd.,2018-07-13 12:26:10,2018-07-13 12:55:25,US/Central,30.219599,-97.756615,0.0,KATT,592.0,E Ben White Blvd,L,Austin,Travis,TX,78704.0
T-13310498,T,Accident,,201.0,Accident on Lavaca St at Cesar Chavez St.,2018-07-13 12:42:52,2018-07-13 13:12:30,US/Central,30.264078,-97.746971,0.0,KATT,298.0,W Cesar Chavez St,R,Austin,Travis,TX,78701.0
T-13310500,T,Accident,,201.0,Accident on Wall St at Cross Park Dr.,2018-07-13 12:43:54,2018-07-13 13:13:03,US/Central,30.338081,-97.676491,0.0,KEDC,8401.0,Wall St,R,Austin,Travis,TX,78754.0
T-13310504,T,Accident,,201.0,Accident on Bastrop Hwy Northbound at Vargas Rd.,2018-07-13 12:45:07,2018-07-13 13:14:31,US/Central,30.239784000000004,-97.68821,0.0,KAUS,,Vargas Rd,R,Austin,Travis,TX,78741.0
T-13310511,T,Accident,,201.0,Accident on US-183 Ed Bluestein Blvd Southbound at Loyola Ln.,2018-07-13 12:54:38,2018-07-13 13:23:35,US/Central,30.302952,-97.661057,0.0,KATT,6514.0,Ed Bluestein Blvd,L,Austin,Travis,TX,78723.0
T-13310530,T,Accident,,201.0,Accident on Bullace St at Vasey Blvd.,2018-07-13 13:18:31,2018-07-13 13:48:13,US/Central,30.257710999999997,-97.578766,0.0,KAUS,15100.0,Bullace St,R,Austin,Travis,TX,78724.0
T-13310540,T,Accident,,201.0,Accident on Hill Dr at Beach Rd.,2018-07-13 13:33:20,2018-07-13 14:03:01,US/Central,30.496183000000002,-97.910172,0.0,KRYW,11399.0,Beach Rd,R,Leander,Williamson,TX,78641.0
T-13310542,T,Accident,,201.0,Right hand shoulder blocked due to accident on MoPac Expy Southbound after Spicewood Springs Rd.,2018-07-13 13:40:45,2018-07-13 14:10:16,US/Central,30.361203999999997,-97.744499,0.0,KATT,,Mopac Expy N,R,Austin,Travis,TX,78731.0
T-13310544,T,Accident,,201.0,Accident on US-290 at Hill Oaks Dr.,2018-07-13 13:43:09,2018-07-13 14:12:31,US/Central,30.233960999999997,-97.871689,0.0,KATT,6798.0,Hill Oaks Dr,R,Austin,Travis,TX,78749.0
T-13310549,T,Accident,,201.0,Accident on MoPac Expy Southbound at FM-2222 Northland Dr.,2018-07-13 13:45:08,2018-07-13 14:29:37,US/Central,30.336502000000003,-97.755646,0.0,KATT,,Mopac Expy S,R,Austin,Travis,TX,78731.0
T-13310554,T,Accident,,201.0,Accident on Steck Ave at Mopac Express .,2018-07-13 13:54:48,2018-07-13 14:24:10,US/Central,30.368126,-97.742363,0.0,KATT,,Mopac Expy N,R,Austin,Travis,TX,78759.0
T-13310571,T,Accident,,201.0,Accident on MoPac Expy at Merrilltown Dr.,2018-07-13 14:34:02,2018-07-13 15:03:21,US/Central,30.449776,-97.696426,0.0,KEDC,,McNeil Merriltown Rd,R,Austin,Travis,TX,78728.0
T-13310615,T,Accident,,201.0,Accident on Davis Ln at Muskdeer Dr.,2018-07-13 16:04:15,2018-07-13 16:33:44,US/Central,30.205339000000002,-97.859116,0.0,KATT,,Muskdeer Dr,R,Austin,Travis,TX,78749.0
T-13310620,T,Accident,,222.0,Queueing traffic due to accident on TX-343 6th St at Guadalupe St.,2018-07-13 16:13:28,2018-07-13 16:42:09,US/Central,30.26902,-97.746284,0.0,KATT,400.0,W 6th St,R,Austin,Travis,TX,78701.0
T-13310646,T,Accident,,201.0,Accident on 3rd St at Robert T Martinez Jr St.,2018-07-13 16:58:19,2018-07-13 17:27:38,US/Central,30.257545,-97.719902,0.0,KATT,307.0,Robert T Martinez Jr St,R,Austin,Travis,TX,78702.0
T-13310653,T,Accident,,201.0,Accident on Directors Blvd at Governors Row.,2018-07-13 17:15:20,2018-07-13 17:45:04,US/Central,30.213253,-97.75032,0.0,KAUS,,Governors Row,R,Austin,Travis,TX,78744.0
T-13310679,T,Accident,,201.0,Accident on Walsh Tarlton Ln Southbound from Sanderling Trl to Wilderness Dr.,2018-07-13 18:00:17,2018-07-13 18:29:55,US/Central,30.269353999999996,-97.803841,0.49000000953699996,KATT,1332.0,Walsh Tarlton Ln,R,Austin,Travis,TX,78746.0
T-13310694,T,Accident,,201.0,Accident on RM-1431 Westbound at Vista Rock Dr.,2018-07-13 18:18:35,2018-07-13 18:47:58,US/Central,30.518803000000002,-97.894958,0.0,KRYW,17907.0,FM 1431,L,Leander,Travis,TX,78641.0
T-13310706,T,Accident,,201.0,Accident on 14th St at San Antonio St.,2018-07-13 18:36:28,2018-07-13 19:06:18,US/Central,30.277239,-97.744423,0.0,KATT,1398.0,San Antonio St,L,Austin,Travis,TX,78701.0
T-13310707,T,Accident,,201.0,Accident on RM-620 Northbound from Boulder Ln to Windy Ridge Rd.,2018-07-13 18:36:05,2018-07-13 19:05:46,US/Central,30.445482000000002,-97.832138,0.239999994636,KRYW,11800.0,Windy Ridge Rd,L,Austin,Travis,TX,78726.0
T-13310715,T,Accident,,201.0,Accident on Scofield Ridge Pkwy at Winwick Way.,2018-07-13 18:50:16,2018-07-13 19:19:40,US/Central,30.429479999999998,-97.69532,0.0,KATT,13300.0,Winwick Way,L,Austin,Travis,TX,78727.0
T-13310729,T,Accident,,201.0,Accident on Howard Ln at McCallen Pass.,2018-07-13 19:06:43,2018-07-13 19:36:29,US/Central,30.419399,-97.66091899999999,0.0,KATT,,W Howard Ln,R,Austin,Travis,TX,78753.0
T-13310750,T,Accident,,201.0,Accident on Slaughter Ln at Francia Trl.,2018-07-13 19:52:50,2018-07-13 20:22:36,US/Central,30.169262,-97.795792,0.0,KAUS,,Francia Trl,R,Austin,Travis,TX,78748.0
T-13310778,T,Accident,,201.0,Accident on 3rd St at Congress Ave.,2018-07-13 20:05:56,2018-07-13 20:35:41,US/Central,30.265271999999996,-97.74382800000001,0.0,KATT,101.0,E 3rd St,R,Austin,Travis,TX,78701.0
T-13310809,T,Accident,,201.0,Accident on Scenic Bluff Dr at Cliffs Edge Dr.,2018-07-13 20:37:54,2018-07-13 21:07:41,US/Central,30.304201000000003,-97.890343,0.0,KATT,9900.0,Scenic Bluff Dr,L,Austin,Travis,TX,78733.0
T-13310823,T,Accident,,201.0,Accident on Boyer Blvd at Metric Blvd.,2018-07-13 20:48:29,2018-07-13 21:18:10,US/Central,30.383905,-97.713387,0.0,KATT,,Boyer Blvd,R,Austin,Travis,TX,78758.0
T-13310887,T,Accident,,201.0,Accident on Ponca St at Thrasher Ln.,2018-07-13 21:20:58,2018-07-13 21:50:38,US/Central,30.236809,-97.694305,0.0,KAUS,6312.0,Ponca St,L,Austin,Travis,TX,78741.0
T-13310900,T,Accident,,201.0,Accident on TX-71 at US-290.,2018-07-13 21:26:29,2018-07-13 21:56:00,US/Central,30.233351000000003,-97.87468,0.0,KATT,,W Highway 71,R,Austin,Travis,TX,78736.0
T-13310938,T,Accident,,201.0,Accident on William Cannon Dr in Austin.,2018-07-13 21:42:45,2018-07-13 22:12:22,US/Central,30.213282,-97.82923100000001,0.0,KATT,3421.0,W William Cannon Dr,L,Austin,Travis,TX,78745.0
T-13310939,T,Accident,,201.0,Accident on US-290 Southbound at TX-290 Manor Expy.,2018-07-13 21:43:37,2018-07-13 22:13:19,US/Central,30.351051000000002,-97.593369,0.0,KEDC,,TX-130 S,R,Manor,Travis,TX,78653.0
T-13311001,T,Accident,,201.0,Accident on Presidential Blvd both ways in Austin.,2018-07-13 22:15:58,2018-07-13 22:45:16,US/Central,30.204334000000003,-97.67021899999999,0.0,KAUS,3323.0,Presidential Blvd,L,Austin,Travis,TX,78719.0
T-13311002,T,Accident,,201.0,Accident on Ernest Robles Way at Brodie Ln.,2018-07-13 22:14:32,2018-07-13 22:44:08,US/Central,30.229485999999998,-97.820374,0.0,KATT,5294.0,Brodie Ln,R,Austin,Travis,TX,78749.0
T-13311003,T,Accident,,201.0,Accident on B.R. Reynolds Dr at TX-343 Lamar Blvd.,2018-07-13 22:14:52,2018-07-13 22:44:40,US/Central,30.265715000000004,-97.75663,0.0,KATT,,S Lamar Blvd,R,Austin,Travis,TX,78704.0
T-13311004,T,Accident,,201.0,Accident on Lamar Blvd at Shoal Creek Blvd.,2018-07-13 22:13:56,2018-07-13 22:43:37,US/Central,30.278799,-97.75071700000001,0.0,KATT,1364.0,N Lamar Blvd,R,Austin,Travis,TX,78701.0
T-13311058,T,Accident,,201.0,Accident on Slaughter Ln in Austin.,2018-07-13 22:40:50,2018-07-13 23:10:36,US/Central,30.166519,-97.78119699999999,0.0,KAUS,317.0,E Slaughter Ln,L,Austin,Travis,TX,78744.0
T-13311061,T,Accident,,201.0,Accident on US-183 Northbound at Research Blvd.,2018-07-13 22:40:20,2018-07-13 23:09:54,US/Central,30.391734999999997,-97.745659,0.0,KATT,9907.0,Research Blvd,R,Austin,Travis,TX,78759.0
T-13311090,T,Accident,,201.0,Accident on Newfield Ln Westbound at MoPac Expy.,2018-07-13 23:05:39,2018-07-13 23:35:17,US/Central,30.285559000000003,-97.76332099999999,0.0,KATT,,Newfield Ln,R,Austin,Travis,TX,78703.0
T-13311091,T,Accident,,201.0,Accident on Harmon Ave at 32nd St.,2018-07-13 23:05:10,2018-07-13 23:34:54,US/Central,30.289848,-97.724602,0.0,KATT,3200.0,Harmon Ave,R,Austin,Travis,TX,78705.0
